{
    "schema": "1.5",
    "hydamo_version": "2.4",
    "status_object": [
		"invalid"
	],
    "objects": [
        {
            "object": "duikersifonhevel",
            "fixes": [
                {
                    "attribute_name": "hoogtebinnenonderkantbov",
                    "validation_ids": [0, 2, 10],
                    "fix_id": 1,
                    "fix_action": "Omit",
                    "fix_type": "automatic",
                    "fix_method": {
                        "difference": {
							"left": "hoogtebinnenonderkantbov",
							"right": 0.2
						}
                    },
                    "fix_description": "Omit feature"
                },
                {
                    "attribute_name": "hoogtebinnenonderkantben",
                    "validation_ids": [1, 3, 11],
                    "fix_id": 1,
                    "fix_action": "Omit",
                    "fix_type": "automatic",
                    "fix_method": {},
                    "fix_description": "Omit feature"
                },
                {
                    "attribute_name": "lengte",
                    "validation_ids": [4],
                    "fix_id": 1,
                    "fix_action": "Omit",
                    "fix_type": "automatic",
                    "fix_method": {},
                    "fix_description": "Omit feature"
                },
                {
                    "attribute_name": "breedteopening",
                    "validation_ids": [5],
                    "fix_id": 2,
                    "fix_action": "Derived assumption",
                    "fix_type": "automatic",
                    "fix_method": {
                        "equal_to": 1000
                    },
                    "fix_description": "DA:breedteopening equal to hoogteopening"
                },
                {
                    "attribute_name": "geometry",
                    "validation_ids": [6,9],
                    "fix_id": 5,
                    "fix_action": "Manual adjustment",
                    "fix_type": "manual",
                    "fix_method": {},
                    "fix_description": "Omit feature"
                },
                {
                    "attribute_name": "slope",
                    "validation_ids": [7],
                    "fix_id": 1,
                    "fix_action": "Omit",
                    "fix_type": "automatic",
                    "fix_method": {},
                    "fix_description": "Omit feature"
                },
                {
                    "attribute_name": "verval",
                    "validation_ids": [8],
                    "fix_id": 1,
                    "fix_action": "Omit",
                    "fix_type": "automatic",
                    "fix_method": {},
                    "fix_description": "Omit feature"
                }
            ]
        }
    ]
}
